{
  "id": "variant_analysis",
  "description": "After a finding, search sibling encodings and analogous paths.",
  "applicability": [
    "white_box",
    "gray_box"
  ],
  "required_facts": [
    "verified primitive"
  ],
  "hypothesis_templates": [
    "An alternate encoding bypasses the same check."
  ],
  "experiment_strategy": "Mutate representation, path, and auth context.",
  "negative_controls": [
    "original reproduction"
  ],
  "evidence_contract": "Variant results stored separately from the original PoC.",
  "known_failure_modes": [
    "declaring complete after one PoC"
  ],
  "relevant_pattern_families": [
    "variant"
  ],
  "recommended_tool_categories": [
    "http_request"
  ],
  "estimated_cost_class": "medium",
  "safety_requirements": [
    "twins only"
  ],
  "provenance": [
    "AROS MVP methodology seed"
  ]
}
