{
  "id": "attack_chain_reasoning",
  "description": "Search composed impact that a single primitive cannot achieve.",
  "applicability": [
    "white_box",
    "gray_box"
  ],
  "required_facts": [
    "primitives"
  ],
  "hypothesis_templates": [
    "Chaining IDOR with a privileged sink yields impact."
  ],
  "experiment_strategy": "Only chain after each primitive is evidenced.",
  "negative_controls": [
    "each hop independently"
  ],
  "evidence_contract": "Per-hop observations plus the chain node.",
  "known_failure_modes": [
    "narrative chains without hops"
  ],
  "relevant_pattern_families": [
    "attack-chain"
  ],
  "recommended_tool_categories": [
    "http_request"
  ],
  "estimated_cost_class": "high",
  "safety_requirements": [
    "fail closed if containment missing"
  ],
  "provenance": [
    "AROS MVP methodology seed"
  ]
}
